{"accounting_method":"provider_reported","agent_id":"taskpack-author-controller","attempt_id":null,"backend":"codex","cached_input_tokens":85760,"coverage_class":"supported_model_invocation","experiment_mode":"agentteam_full","experiment_protocol_sha256":"01bd1bbca555a0c61f509a3d9077928bfd539033c27ed19ff45e8071170cedb3","experiment_run_id":"experiment-run-add42cb8b36160626468cdd2183df60d0db74e4da6ec1cdda32a73bcf090b62d","experiment_run_manifest_sha256":"368b545329f4cc2b4e2a3ffad2d2a4f4fc60e91696b77311d9d8034b3f51cc2e","experiment_sandbox_policy_sha256":"7710265c2dad2746b11b04c0b5bd5e591a98242bc6bb3934f01e38be099be6bd","experiment_sandbox_reference_sha256":"5b3073d7ade59067fad3d2e92bf1c2fb5c0dd92cf438967e6e127959ffb623b1","finished_at":"2026-08-11T10:43:33Z","gate_epoch":null,"implementation_run_id":null,"input_tokens":100552,"invocation_id":"INV-4284d10622bd4ae3acccea2be4d2c9cd","lifecycle_owner_token":"AUTHOR-OWNER-445f2b97917a48cba66fb654226a6a57","model":"gpt-5.6-sol","output_tokens":3412,"project":"repository","provider_predecessor_invocation_id":null,"provider_predecessor_turn_id":null,"provider_session_id":null,"provider_turn_id":null,"provider_usage_scope":"invocation","provider_usage_snapshot":null,"pursue_id":null,"reasoning_profile":"high","reasoning_tokens":418,"role":"taskpack_author","round_index":null,"run_id":"experiment-run-add42cb8b36160626468cdd2183df60d0db74e4da6ec1cdda32a73bcf090b62d","runtime_execution_session_id":"AUTHOR-SESSION-9890afcc991a49b5a04de398f93dc9ab","source_artifact_path":"model_invocations/INV-4284d10622bd4ae3acccea2be4d2c9cd/stdout.jsonl","start_sha256":"f549f81a2539b61a1c1913d7c16b00f3421552c416d578f18be435424611cffb","started_at":"2026-08-11T10:41:52Z","task_id":null,"taskpack_id":"experiment-full-mode-author","terminal_status":"completed","terminal_writer":"taskpack_author","total_tokens":103964,"unavailable_reason":null,"usage_event_id":"USAGE-4d6d159f28d4b8a54088a2a1534e257ccea2973988ee9b929ce5c3a67a42da61","usage_schema_version":"model_invocation_usage.v1","usage_source":"codex_jsonl","usage_stage":"taskpack_author","usage_status":"reported","wall_time_seconds":101.0}
