{"accounting_method":"provider_reported","agent_id":"single-codex-controller","attempt_id":null,"backend":"codex","cached_input_tokens":124160,"coverage_class":"supported_model_invocation","experiment_mode":"single_codex","experiment_protocol_sha256":"01bd1bbca555a0c61f509a3d9077928bfd539033c27ed19ff45e8071170cedb3","experiment_run_id":"experiment-run-b8594d9f60024719854b0a66816799ac2d517be1e9415a71fa81ad12c629811b","experiment_run_manifest_sha256":"2dcb3afc12f4aef33ca3d98f20fd522eceaa4e17dcf8a1d0543c5e953f7623f7","experiment_sandbox_policy_sha256":"edd4cd43b071ba8b03f5fd52f78d9730958c81b906324b05497962e9e6733ecd","experiment_sandbox_reference_sha256":"de72dcb5ba9ad1ba501e0e5e6bbb09d6698f4267c7ae0e33848361681a9c39f3","finished_at":"2026-08-11T10:36:19Z","gate_epoch":null,"implementation_run_id":null,"input_tokens":139582,"invocation_id":"INV-74e22867794f4d29a6e01c082c957c54","lifecycle_owner_token":"SINGLE-OWNER-f2494f364eab4a87a841820a81879f4d","model":"gpt-5.6-sol","output_tokens":2386,"project":"repository","provider_predecessor_invocation_id":null,"provider_predecessor_turn_id":null,"provider_session_id":null,"provider_turn_id":null,"provider_usage_scope":"invocation","provider_usage_snapshot":null,"pursue_id":null,"reasoning_profile":"high","reasoning_tokens":530,"role":"implementation_worker","round_index":null,"run_id":"experiment-run-b8594d9f60024719854b0a66816799ac2d517be1e9415a71fa81ad12c629811b","runtime_execution_session_id":"SINGLE-SESSION-a14bfbc30d914be8a30b2290efcc3e5d","source_artifact_path":"model_invocations/INV-74e22867794f4d29a6e01c082c957c54/stdout.jsonl","start_sha256":"324a50f74624c45c97c434af52e75a2d2ed2c9b64ebffbd9393ccc5227b40b2f","started_at":"2026-08-11T10:34:45Z","task_id":null,"taskpack_id":"SINGLE-CODEX-NONE","terminal_status":"completed","terminal_writer":"worker","total_tokens":141968,"unavailable_reason":null,"usage_event_id":"USAGE-b087c4f2768de550a5143962acbfb2ff623b9e85a0c90a1809e0bf4e393676b4","usage_schema_version":"model_invocation_usage.v1","usage_source":"codex_jsonl","usage_stage":"single_codex","usage_status":"reported","wall_time_seconds":94.0}
